{
  "id": "it-oncall-deployment-rest",
  "scenario": "On-call deployment and rest period validation",
  "description": "Synthetic on-call case with one overnight deployment.",
  "policyVersion": 1,
  "input": {
    "personCode": "EMP_SYN_031",
    "rotationStart": "2026-03-12T16:00:00Z",
    "rotationEnd": "2026-03-19T08:00:00Z",
    "deployments": [
      {
        "start": "2026-03-14T01:10:00Z",
        "end": "2026-03-14T02:20:00Z"
      }
    ],
    "nextShiftStart": "2026-03-14T14:00:00Z"
  },
  "expected": {
    "restHoursAfterDeployment": 11.67,
    "minimumRestHours": 11,
    "compliant": true,
    "violations": []
  }
}
