{
  "id": "time-engine-surcharge-holiday-overlap",
  "scenario": "Holiday overlap outranks weekend and night surcharges",
  "description": "Synthetic rule-engine case for holiday/weekend/night precedence handling.",
  "policyVersion": 1,
  "input": {
    "week": "2026-W14",
    "targetHours": 0,
    "timezone": "Europe/Berlin",
    "holidayDates": ["2026-04-05"],
    "intervals": [
      {
        "start": "2026-04-05T20:00:00.000Z",
        "end": "2026-04-05T21:00:00.000Z",
        "type": "WORK"
      }
    ]
  },
  "expected": {
    "actualHours": 1,
    "deltaHours": 1,
    "violations": [],
    "warnings": [],
    "surchargeMinutes": [
      {
        "category": "HOLIDAY",
        "ratePercent": 100,
        "minutes": 60
      }
    ]
  }
}
